{
  "schema_version": 5,
  "id": "PMG-20260801-01",
  "project": "AIPLATFORM",
  "summary": "Add an evidence link",
  "created_at": "2026-08-01T00:00:00Z",
  "expires_at": "2026-08-02T00:00:00Z",
  "status": "proposed",
  "payload_hash": "457da75f43960a2b75197a3231c69c94439ec45285f6e1b25a7bcb401447f72d",
  "approval": {
    "group_approved_by": null,
    "approved_action_ids": [],
    "approved_at": null,
    "payload_hash": null
  },
  "actions": [
    {
      "id": "PMA-20260801-01",
      "system": "jira",
      "operation": "issue.comment",
      "target_ref": "AIPLATFORM-101",
      "target_version": "2026-08-01T00:00:00Z",
      "before_state": {
        "issue_key": "AIPLATFORM-101",
        "human_content_language": "en-US"
      },
      "desired_state": {
        "body": "Bằng chứng: CI đã đạt",
        "content_language": "vi-VN",
        "literal_preservation": {"policy_ref": ".kilo/config/jiraman.json#/language/preserved_literal_kinds", "mode": "exact"},
        "existing_content_mode": "preserve-human-content"
      },
      "evidence": [
        "repository CI result"
      ],
      "reason": "Record validation evidence",
      "preconditions": [
        "issue remains in AIPLATFORM"
      ],
      "dependencies": [],
      "risk": "low",
      "approval_required": "group",
      "expires_at": "2026-08-02T00:00:00Z",
      "rollback_guidance": "Remove the comment manually if incorrect",
      "status": "proposed"
    }
  ]
}
